{
  "$schema": "http://json-schema.org/draft-07/schema#",
  "title": "Clerkenwell Projection Definition",
  "type": "object",
  "additionalProperties": false,
  "required": [
    "version",
    "namespace",
    "entities",
    "projections",
    "mutations",
    "collaboration",
    "$defs"
  ],
  "properties": {
    "version": {
      "type": "integer",
      "minimum": 1
    },
    "namespace": {
      "type": "string",
      "minLength": 1
    },
    "entities": {
      "type": "object",
      "additionalProperties": { "$ref": "#/definitions/entity" },
      "minProperties": 1
    },
    "projections": {
      "type": "object",
      "additionalProperties": { "$ref": "#/definitions/projection" }
    },
    "mutations": {
      "type": "object",
      "additionalProperties": { "$ref": "#/definitions/mutation" },
      "minProperties": 1
    },
    "commands": {
      "type": "object",
      "additionalProperties": { "$ref": "#/definitions/command" }
    },
    "collaboration": { "$ref": "#/definitions/collaboration" },
    "$defs": {
      "type": "object",
      "additionalProperties": { "$ref": "#/definitions/schemaNode" },
      "minProperties": 1
    }
  },
  "definitions": {
    "entity": {
      "type": "object",
      "additionalProperties": false,
      "required": ["id", "schema", "revision", "authoring"],
      "properties": {
        "id": { "type": "string", "minLength": 1 },
        "schema": { "$ref": "#/definitions/schemaRef" },
        "revision": { "$ref": "#/definitions/revision" },
        "authoring": { "$ref": "#/definitions/authoringPolicy" }
      }
    },
    "authoringPolicy": {
      "type": "object",
      "additionalProperties": false,
      "required": ["kind", "planningMutations"],
      "properties": {
        "kind": {
          "enum": [
            "optimisticDocument",
            "collaborative",
            "commandOwned",
            "readOnly"
          ]
        },
        "planningMutations": {
          "type": "array",
          "items": { "type": "string", "minLength": 1 },
          "uniqueItems": true
        }
      }
    },
    "revision": {
      "type": "object",
      "additionalProperties": false,
      "required": ["kind"],
      "properties": {
        "kind": { "enum": ["contentHash", "replica"] },
        "field": { "type": "string", "minLength": 1 }
      },
      "allOf": [
        {
          "if": {
            "properties": {
              "kind": { "const": "contentHash" }
            }
          },
          "then": {
            "required": ["field"]
          }
        },
        {
          "if": {
            "properties": {
              "kind": { "const": "replica" }
            }
          },
          "then": {
            "not": {
              "required": ["field"]
            }
          }
        }
      ]
    },
    "projection": {
      "type": "object",
      "additionalProperties": false,
      "required": ["description", "params", "snapshot", "patch", "dependsOn", "materialization"],
      "properties": {
        "description": { "$ref": "#/definitions/description" },
        "params": { "$ref": "#/definitions/schemaRef" },
        "snapshot": { "$ref": "#/definitions/schemaRef" },
        "patch": { "$ref": "#/definitions/schemaRef" },
        "dependsOn": {
          "type": "array",
          "items": { "type": "string", "minLength": 1 },
          "minItems": 1
        },
        "materialization": { "$ref": "#/definitions/materialization" }
      }
    },
    "materialization": {
      "type": "object",
      "additionalProperties": false,
      "required": ["strategy"],
      "properties": {
        "strategy": {
          "enum": [
            "keyedCollection",
            "sequencedText",
            "replaceOrRemove",
            "replace",
            "reset"
          ]
        },
        "collectionField": { "type": "string", "minLength": 1 },
        "itemField": { "type": "string", "minLength": 1 },
        "itemIdentityField": { "type": "string", "minLength": 1 },
        "patchIdentityField": { "type": "string", "minLength": 1 },
        "snapshotOutputField": { "type": "string", "minLength": 1 },
        "sequenceField": { "type": "string", "minLength": 1 },
        "textField": { "type": "string", "minLength": 1 },
        "patchOutputField": { "type": "string", "minLength": 1 },
        "deltaTextField": { "type": "string", "minLength": 1 },
        "snapshotMode": { "enum": ["patch", "field"] },
        "snapshotField": { "type": "string", "minLength": 1 },
        "snapshotOmitFields": {
          "type": "array",
          "items": { "type": "string", "minLength": 1 },
          "uniqueItems": true
        },
        "removeMode": { "enum": ["nullSnapshot", "nullField"] },
        "removeField": { "type": "string", "minLength": 1 },
        "updateField": { "type": "string", "minLength": 1 },
        "updatesField": { "type": "string", "minLength": 1 }
      },
      "allOf": [
        {
          "if": {
            "properties": { "strategy": { "const": "keyedCollection" } }
          },
          "then": {
            "required": [
              "collectionField",
              "itemField",
              "itemIdentityField",
              "patchIdentityField"
            ]
          }
        },
        {
          "if": {
            "properties": { "strategy": { "const": "replaceOrRemove" } }
          },
          "then": {
            "required": ["snapshotMode", "removeMode"]
          }
        },
        {
          "if": {
            "properties": { "strategy": { "const": "sequencedText" } }
          },
          "then": {
            "required": [
              "collectionField",
              "itemIdentityField",
              "patchIdentityField",
              "snapshotOutputField",
              "sequenceField",
              "textField",
              "patchOutputField",
              "deltaTextField"
            ]
          }
        },
        {
          "if": {
            "properties": { "strategy": { "const": "replace" } }
          },
          "then": {
            "required": ["snapshotMode"]
          }
        },
        {
          "if": {
            "properties": { "snapshotMode": { "const": "field" } },
            "required": ["snapshotMode"]
          },
          "then": {
            "required": ["snapshotField"]
          }
        },
        {
          "if": {
            "properties": { "removeMode": { "const": "nullField" } },
            "required": ["removeMode"]
          },
          "then": {
            "required": ["removeField"]
          }
        }
      ]
    },
    "mutation": {
      "type": "object",
      "additionalProperties": false,
      "required": ["description", "params", "result", "touches"],
      "properties": {
        "description": { "$ref": "#/definitions/description" },
        "params": { "$ref": "#/definitions/schemaRef" },
        "result": { "$ref": "#/definitions/schemaRef" },
        "touches": {
          "type": "array",
          "items": { "type": "string", "minLength": 1 },
          "minItems": 1,
          "uniqueItems": true
        }
      }
    },
    "command": {
      "type": "object",
      "additionalProperties": false,
      "required": ["description", "params", "result"],
      "properties": {
        "description": { "$ref": "#/definitions/description" },
        "params": { "$ref": "#/definitions/schemaRef" },
        "result": { "$ref": "#/definitions/schemaRef" },
        "touches": {
          "type": "array",
          "items": { "type": "string", "minLength": 1 },
          "uniqueItems": true
        }
      }
    },
    "collaboration": {
      "type": "object",
      "additionalProperties": false,
      "required": ["version", "entities"],
      "properties": {
        "version": {
          "type": "integer",
          "minimum": 1
        },
        "entities": {
          "type": "object",
          "additionalProperties": { "$ref": "#/definitions/collaborationEntity" },
          "minProperties": 1
        }
      }
    },
    "collaborationEntity": {
      "type": "object",
      "additionalProperties": false,
      "required": [
        "schemaVersion",
        "authoringState",
        "rootContainer",
        "fields"
      ],
      "properties": {
        "schemaVersion": {
          "type": "integer",
          "minimum": 1
        },
        "authoringState": { "$ref": "#/definitions/collaborationAuthoringState" },
        "rootContainer": { "type": "string", "minLength": 1 },
        "fields": {
          "type": "object",
          "additionalProperties": { "$ref": "#/definitions/collaborationField" },
          "minProperties": 1
        }
      }
    },
    "collaborationAuthoringState": {
      "type": "object",
      "additionalProperties": false,
      "required": ["projection", "importMutation"],
      "properties": {
        "projection": { "type": "string", "minLength": 1 },
        "importMutation": { "type": "string", "minLength": 1 },
        "document": { "type": "string", "minLength": 1 },
        "storeParams": {
          "type": "array",
          "uniqueItems": true,
          "items": { "type": "string", "minLength": 1 }
        }
      }
    },
    "collaborationField": {
      "type": "object",
      "additionalProperties": false,
      "required": ["storage", "value", "required", "conflict"],
      "properties": {
        "storage": { "$ref": "#/definitions/collaborationStorage" },
        "value": { "$ref": "#/definitions/collaborationValue" },
        "required": { "type": "boolean" },
        "requiredInParent": { "type": "boolean" },
        "conflict": { "$ref": "#/definitions/collaborationConflict" },
        "writers": {
          "type": "object",
          "minProperties": 1,
          "propertyNames": { "enum": ["human", "agent", "service", "system"] },
          "additionalProperties": { "$ref": "#/definitions/collaborationConflict" }
        }
      }
    },
    "collaborationConflict": {
      "enum": ["immutable", "explicit", "merge", "lastWriterWins"]
    },
    "collaborationStorage": {
      "type": "object",
      "additionalProperties": false,
      "required": ["kind"],
      "properties": {
        "kind": {
          "enum": [
            "scalar",
            "text",
            "orderedList",
            "structuredList",
            "structuredMap",
            "structuredDocument",
            "derivedIdentity",
            "derivedRevision",
            "keyedSequence"
          ]
        },
        "container": { "type": "string", "minLength": 1 },
        "containerTemplate": { "type": "string", "minLength": 1 },
        "key": { "type": "string", "minLength": 1 },
        "identityPath": { "type": "string", "minLength": 1 },
        "identityVariable": { "type": "string", "minLength": 1 },
        "orderContainer": { "type": "string", "minLength": 1 },
        "itemContainerTemplate": { "type": "string", "minLength": 1 },
        "metadataContainer": { "type": "string", "minLength": 1 },
        "metadataContainerTemplate": { "type": "string", "minLength": 1 },
        "metadataKey": { "type": "string", "minLength": 1 }
      }
    },
    "collaborationValue": {
      "type": "object",
      "additionalProperties": false,
      "required": ["codec"],
      "properties": {
        "codec": {
          "enum": [
            "integer",
            "number",
            "optionalNumber",
            "boolean",
            "string",
            "optionalString",
            "propertyText",
            "stringList",
            "structuredJson",
            "identity",
            "keyedSequence"
          ]
        },
        "schema": { "$ref": "#/definitions/schemaRef" }
      }
    },
    "description": {
      "type": "string",
      "pattern": "\\S"
    },
    "schemaRef": {
      "type": "object",
      "additionalProperties": false,
      "required": ["$ref"],
      "properties": {
        "$ref": {
          "type": "string",
          "pattern": "^#\\/\\$defs\\/[A-Za-z][A-Za-z0-9]*$"
        }
      }
    },
    "schemaNode": {
      "type": "object",
      "additionalProperties": true
    }
  }
}
